Dec 13 2022 05:30AM,SBI Life Insurance Company Ltd,SBILIFE,0-3000000,0-25,50-75
Dec 13 2022 05:30AM,Nippon India ETF Nifty Next 50 Junior BeES,JUNIORBEES,0-3000000,25-50,50-75
Dec 13 2022 05:30AM,BF Investment Ltd,BFINVEST,0-3000000,0-25,50-75
Dec 13 2022 05:30AM,B.C. Power Controls Ltd,BCP,0-3000000,0-25,50-75
Dec 13 2022 05:30AM,Nippon India ETF Nifty India Consumption,CONSUMBEES,0-3000000,25-50,50-75
Dec 13 2022 05:30AM,H.G. Infra Engineering Ltd,HGINFRA,0-3000000,0-25,50-75
Dec 13 2022 05:30AM,Uniinfo Telecom Services Ltd,UNIINFO,0-3000000,0-25,50-75
Dec 13 2022 05:30AM,DSP Nifty Midcap 150 Quality 50 ETF,DSPQ50ETF,0-3000000,25-50,50-75
